{
  "schema": "opendap.matrix/v1",
  "id": "radio-architecture",
  "question": "Which radio architecture for the HAT?",
  "status": "recommendation",
  "sources": {"ds1": {"citation": "Module datasheet rev 2, p. 4", "status": "sourced"}},
  "options": [{"id": "a", "name": "Module A", "sources": ["ds1"]}, {"id": "b", "name": "Module B"}],
  "criteria": [{"id": "G1", "title": "Fits the HAT envelope", "kind": "hard"}, {"id": "G5", "title": "Certification effort", "kind": "info"}],
  "results": [
    {"option": "a", "criterion": "G1", "state": "pass", "why": "12 mm under the 14 mm limit"},
    {"option": "b", "criterion": "G1", "state": "fail", "why": "16 mm over the 14 mm limit"},
    {"option": "a", "criterion": "G5", "state": "info", "why": "pre-certified module"}
  ],
  "aggregation": "all-hard-pass",
  "verdicts": [{"option": "a", "verdict": "pass", "rank": 1}, {"option": "b", "verdict": "fail", "blockers": ["G1"]}],
  "recommendation": {"option": "a", "rule": "only option passing every hard gate", "labelled": true}
}
